Date,Title,Link,Content
19 May 2025,Commission announces launch of the shared biometric matching service,https://home-affairs.ec.europa.eu/news/commission-announces-launch-shared-biometric-matching-service-2025-05-19_en,"The European Commission has announced the launch of the shared biometric matching service (sBMS), a major step towards seamless interoperability. This marks a significant milestone in the EU's efforts to enhance security, border, and migration management."
19 May 2025,First-ever certified reference material to improve diagnosis of coeliac disease,https://joint-research-centre.ec.europa.eu/jrc-news-and-updates/first-ever-certified-reference-material-improve-diagnosis-coeliac-disease-2025-05-19_en,"A new, JRC-developed control material will support labs worldwide to compare medical tests for coeliac disease and improve the accuracy of diagnosis."
19 May 2025,Join Us at European Maritime Day 2025 in Cork!,https://blue-economy-observatory.ec.europa.eu/news/join-us-european-maritime-day-2025-cork-2025-05-19_en,Join Us at European Maritime Day 2025 in Cork!
19 May 2025,PRB-PRC joint study on the actual benefits of Free Route Airspace,https://eu-single-sky.transport.ec.europa.eu/news/prb-prc-joint-study-actual-benefits-free-route-airspace-2025-05-19_en,PRB-PRC joint study on the actual benefits of Free Route Airspace
19 May 2025,New chapter in EU-UK relations announced at Leaders' Summit in London,https://ec.europa.eu/commission/presscorner/detail/en/ac_25_1280,At EU-UK Summit in London the two parties concluded a Security and Defence Partnership and reached agreements on several economic fronts. This will promote prosperity on both sides of the Channel and strengthen cooperation on common priorities.
19 May 2025,Results of 19-05-2025 auction (EU-Bonds),https://commission.europa.eu/news/results-19-05-2025-auction-eu-bonds-2025-05-19_en,Auction results EU-Bonds
19 May 2025,First-ever certified reference material to improve diagnosis of coeliac disease,https://joint-research-centre.ec.europa.eu/jrc-news-and-updates/first-ever-certified-reference-material-improve-diagnosis-coeliac-disease-2025-05-19_en,"A new, JRC-developed control material will support labs worldwide to compare medical tests for coeliac disease and improve the accuracy of diagnosis."
19 May 2025,Join Us at European Maritime Day 2025 in Cork!,https://blue-economy-observatory.ec.europa.eu/news/join-us-european-maritime-day-2025-cork-2025-05-19_en,Join Us at European Maritime Day 2025 in Cork!
19 May 2025,Pioneering sustainable fishing gear in Puglia,https://oceans-and-fisheries.ec.europa.eu/news/pioneering-sustainable-fishing-gear-puglia-2025-05-19_en,"Around 550,000 tonnes of fishing gear have accumulated in the European Economic Area, with 12,000 tonnes added annually. The Fishing Without Plastic (PE.S.PLA) project aimed to combat this by developing biodegradable materials for artisanal fishing gear, reducing environmental impact."
19 May 2025,New EIT Urban Mobility study calls for inclusive transport beyond the 9–5 model,https://urban-mobility-observatory.transport.ec.europa.eu/news-events/news/new-eit-urban-mobility-study-calls-inclusive-transport-beyond-9-5-model-2025-05-19_en,A new EIT Urban Mobility study examines how public transport networks throughout Europe can change to become more inclusive and adaptable to the various demands of contemporary urban dwellers.
19 May 2025,EU economy projected to moderately grow amid global economic uncertainty,https://commission.europa.eu/news/eu-economy-projected-moderately-grow-amid-global-economic-uncertainty-2025-05-19_en,The European Commission has published its spring 2025 economic forecast.
19 May 2025,More than 6.1 million workers trained under the Pact for Skills,https://ec.europa.eu/commission/presscorner/detail/en/ip_25_1247,"More than 6.1 million people have received training under the Pact for Skills since its launch in 2020, according to the results of the 2024 Pact's annual survey."
19 May 2025,Spring 2025 Economic Forecast: Moderate growth amid global economic uncertainty,https://ec.europa.eu/commission/presscorner/detail/en/ip_25_1248,"The EU economy began 2025 on a somewhat stronger footing than anticipated. It is projected to keep growing at a modest rate this year, with growth expected to pick up in 2026, despite heightened global policy uncertainty and trade tensions."
16 May 2025,"European Political Community united to preserve peace in Europe, President von der Leyen says",https://ec.europa.eu/commission/presscorner/detail/en/ac_25_1251,No content found
16 May 2025,Have your say on the future of European investments in digital technologies,https://investeu.europa.eu/news-and-events/news/have-your-say-future-european-investments-digital-technologies-2025-05-16_en,"We invite InvestEU’s project promoters and investors to share their views, through series of surveys, on the future outlook of markets, dependences and trends on a wide array of digital technologies critical for the EU’s competitiveness in view of investment needs for the next EC programming period."
16 May 2025,"Food crises: in 2024, nearly 300 m people suffered high levels of acute food insecurity",https://joint-research-centre.ec.europa.eu/jrc-news-and-updates/food-crises-2024-nearly-300-m-people-suffered-high-levels-acute-food-insecurity-2025-05-16_en,"The latest edition of the Global Report on Food Crises warns of devastating food security and nutrition crises, with no signs of improvement in 2025."
16 May 2025,Study on Health Taxes from an EU Perspective,https://taxation-customs.ec.europa.eu/news/study-health-taxes-eu-perspective-2025-05-16_en,"DG TAXUD publishes study on taxes on food high in fat, sugar and salt in the European Union."
16 May 2025,Vacancy for Assistants (establishment of a reserve list) (Contract Agent– FGIII) at the Europe's Rail Joint Undertaking (EU-RAIL),https://transport.ec.europa.eu/news-events/news/vacancy-assistants-establishment-reserve-list-contract-agent-fgiii-europes-rail-joint-undertaking-eu-2025-05-16_en,The deadline for applications is 05 June 2025 12:00 (Central European Time/ Brussels time)
16 May 2025,EU agri-food trade kicked off 2025 with growth in exports and imports,https://agriculture.ec.europa.eu/media/news/eu-agri-food-trade-kicked-2025-growth-exports-and-imports-2025-05-16_en,The latest monthly agri-food trade report shows developments in imports and exports of EU agri-food products in January 2025.
16 May 2025,Platform launch marks new milestone for the EU textiles ecosystem,https://single-market-economy.ec.europa.eu/news/platform-launch-marks-new-milestone-eu-textiles-ecosystem-2025-05-16_en,"The event took place on 16 May from 10.00 - 12.00. It included a guided tour of the platform, and a talk on how stakeholders can publish articles, access funding and network with others."
16 May 2025,Commission seeks feedback on commitments offered by Microsoft over possible anticompetitive practices related to Teams,https://competition-policy.ec.europa.eu/about/news/commission-seeks-feedback-commitments-offered-microsoft-over-possible-anticompetitive-practices-2025-05-16_en,press release
16 May 2025,Announcement of next auction (EU-Bills) on 21-05-2025,https://commission.europa.eu/news/announcement-next-auction-eu-bills-21-05-2025-2025-05-16_en,Auction announcement EU-Bills.
16 May 2025,Important step towards establishing the European Network of Network Operators for Hydrogen,https://energy.ec.europa.eu/news/important-step-towards-establishing-european-network-network-operators-hydrogen-2025-05-16_en,The Commission has published its Opinion on the statutory documents of the European Network of Network Operators for Hydrogen (ENNOH) – the independent association representing future hydrogen transmission network operators at EU level.
16 May 2025,Nuclear Innovation Prize 2025: Celebrating scientific excellence with direct societal impact,https://research-and-innovation.ec.europa.eu/news/all-research-and-innovation-news/nuclear-innovation-prize-2025-celebrating-scientific-excellence-direct-societal-impact-2025-05-16_en,Seven breakthrough ideas awarded for contributing to safer and more sustainable nuclear technologies
16 May 2025,Limerick Active Travel Project wins prestigious award,https://urban-mobility-observatory.transport.ec.europa.eu/news-events/news/limerick-active-travel-project-wins-prestigious-award-2025-05-16_en,Limerick's efforts to promote sustainable travel gets national recognition as the Childers Road Active Travel Scheme wins prestigious ICE Award.
16 May 2025,The road to 2030: what’s in store for work?,https://eures.europa.eu/road-2030-whats-store-work-2025-05-16_en,"The world continues to experience sweeping changes, and to stay relevant, our jobs and skills are evolving or disappearing altogether. What should we expect to see by 2030?"
16 May 2025,REPowerEU 3 years on: Commission takes stock of progress to phase out Russian fossil fuels,https://energy.ec.europa.eu/news/repowereu-3-years-commission-takes-stock-progress-phase-out-russian-fossil-fuels-2025-05-16_en,"Marking 3 years since the launch of the REPowerEU Plan, the Commission takes stock of progress towards cleaner, more autonomous and affordable energy."
16 May 2025,Benidorm Leads Europe’s Green Coastal Shift: A Smart Tourism Model for Climate Resilience,https://smart-tourism-capital.ec.europa.eu/news/benidorm-leads-europes-green-coastal-shift-smart-tourism-model-climate-resilience-2025-05-16_en,"Benidorm may be known for its golden coastline and sunny skies, but it’s the city’s approach to sustainability that has earned it the title of European Green Pioneer of Smart Tourism 2025."
16 May 2025,European Commission launches Study on alternative employment models for persons with disabilities,https://accessible-eu-centre.ec.europa.eu/content-corner/news/european-commission-launches-study-alternative-employment-models-persons-disabilities-2025-05-16_en,"The study is part of the Disability Employment Package, an EU initiative stemming from the Strategy for the Rights of Persons with Disabilities 2021-2030."
16 May 2025,The European Strategy for AI in Science: a RTD-JRC Stakeholder Event,https://ai-watch.ec.europa.eu/news/european-strategy-ai-science-rtd-jrc-stakeholder-event-2025-05-16_en,"On 15 May 2025, the European Commission hosted an online workshop bringing together 76 researchers from 11 countries to contribute to the forthcoming EU Strategy on Artificial Intelligence in Science."
16 May 2025,"EBRD, EU, GCF and Canada promote green lending in Morocco’s private sector",https://north-africa-middle-east-gulf.ec.europa.eu/news/ebrd-eu-gcf-and-canada-promote-green-lending-moroccos-private-sector-2025-05-16_en,"EBRD, GCF and Canada through HIPCA lend €70 million to Bank of Africa in Morocco under GEFF plus programme. EU providing technical assistance and investment incentives to accompany SMEs in their green investments. Funds to boost access to green finance for private sector and promote capacity..."
16 May 2025,Joint statement after a meeting with President Maia Sandu of Moldova,https://enlargement.ec.europa.eu/news/joint-statement-after-meeting-president-maia-sandu-moldova-2025-05-16_en,"We, the President of the European Commission, the leaders of France, Germany, Italy, Poland, Romania, and the United Kingdom"
16 May 2025,European Political Community united to preserve peace in Europe,https://ec.europa.eu/commission/presscorner/detail/en/ac_25_1251,"At the summit of the European Political Community in Tirana, Albania, President von der Leyen stressed the importance to foster peace and stability in Europe. She also announced the soon upcoming strategy for the Black Sea region and spoke of the connectivity agenda linking Europe to Central Asia."
22 May 2025,"Registrations for the conference ""R&I for a Competitive Green Transition"" are now open",https://research-and-innovation.ec.europa.eu/news/all-research-and-innovation-news/registrations-conference-ri-competitive-green-transition-are-now-open-2025-05-22_en,"Registrations are now open for the ""R&I for a Competitive Green Transition"" conference, taking place on 23-24 June 2025 in Brussels and online."
22 May 2025,Innovation in EU blue economy boosts growth,https://joint-research-centre.ec.europa.eu/jrc-news-and-updates/innovation-eu-blue-economy-boosts-growth-2025-05-22_en,EU blue economy employs almost 5 million people and generates nearly EUR 890 billion in turnover.
22 May 2025,First EU Cancer Mission Conference in Poland this June,https://research-and-innovation.ec.europa.eu/news/all-research-and-innovation-news/first-eu-cancer-mission-conference-poland-june-2025-05-22_en,"Policymakers, researchers, healthcare professionals, patient advocates and civil society representatives from across Europe will come together in Warsaw this June for the EU Cancer Mission Conference “Together Against Cancer through Research and Innovation“ on 17 June 2025."
22 May 2025,Commission publishes 2025 report on EU blue economy,https://oceans-and-fisheries.ec.europa.eu/news/commission-publishes-2025-report-eu-blue-economy-2025-05-22_en,"Today, the European Commission published its 2025 EU Blue Economy Report. The report presents the economic performance of the EU blue economy sectors and provides estimations of their economic performance."
22 May 2025,Commission welcomes political agreement on compulsory licensing to enhance EU crisis resilience,https://ec.europa.eu/commission/presscorner/detail/en/ip_25_1312,No content found
22 May 2025,EIF announces €40 million investment in Keen Venture Partners' European defence and security Tech fund under InvestEU,https://ec.europa.eu/commission/presscorner/detail/en/ip_25_1242,No content found
21 May 2025,Results of 21-05-2025 auction (EU-Bills),https://commission.europa.eu/news/results-21-05-2025-auction-eu-bills-2025-05-21_en,Auction results EU-Bills.
21 May 2025,Syria: Council statement on the lifting of EU economic sanctions,https://north-africa-middle-east-gulf.ec.europa.eu/news/syria-council-statement-lifting-eu-economic-sanctions-2025-05-21_en,"The EU has stood with the Syrian people throughout the last 14 years, engaging in the search for a political solution and leading financial assistance. The EU also adopted sanctions against Assad’s criminal regime."
21 May 2025,EU announces €80 million humanitarian aid package for Yemen,https://north-africa-middle-east-gulf.ec.europa.eu/news/eu-announces-eu80-million-humanitarian-aid-package-yemen-2025-05-21_en,"The Commission has announced €80 million in EU humanitarian funding for 2025 to support people in need in Yemen. Yemen continues to rank among the worst humanitarian crises in the world. One decade of conflict, economic deterioration and recurrent climate-induced events have left 19.5 million people"
21 May 2025,Yemen: Council approves conclusions calling for a renewed momentum in the peace efforts,https://north-africa-middle-east-gulf.ec.europa.eu/news/yemen-council-approves-conclusions-calling-renewed-momentum-peace-efforts-2025-05-21_en,"Today, the Council approved conclusions on Yemen expressing the EU's grave concern over the deterioration of the security, economic and humanitarian situation in the country."
15 May 2025,Need for strong networks emphasized as critical priority for women-led startups during the WomenINvestEU panel at the Wolves Summit,https://women-invest.ec.europa.eu/news/need-strong-networks-emphasized-critical-priority-women-led-startups-during-womeninvesteu-panel-2025-05-15_en,"WomenINvestEU held its panel on ""Bridging Eastern & Western Europe in Financing Women-led Deep Tech Startups"" at the Wolves Summit, in Warsaw, on 6 May."
15 May 2025,New approach to VAT for e-commerce imports to simplify trade and compliance,https://taxation-customs.ec.europa.eu/news/new-approach-vat-e-commerce-imports-simplify-trade-and-compliance-2025-05-15-0_en,EU finance ministers reached a significant agreement on a new approach to the Value Added Tax (VAT) focusing on e-commerce imports and the taxation of distance sales of imported goods.
15 May 2025,EU allocates €120 million in humanitarian aid for Latin America and the Caribbean in 2025,https://civil-protection-humanitarian-aid.ec.europa.eu/news-stories/news/eu-allocates-eu120-million-humanitarian-aid-latin-america-and-caribbean-2025-2025-05-15_en,"Several Latin American and Caribbean countries are grappling with humanitarian challenges, mainly due to the Venezuela crisis, natural disasters, and armed conflicts. The European Commission will provide €120 million in humanitarian aid this year to help the region's most vulnerable."
15 May 2025,EU invests in researchers and invites them to ‘Choose Europe for science’,https://european-union.europa.eu/eu-invests-researchers-and-invites-them-choose-europe-science-2025-05-15_en,"New calls worth over €1.25 billion under the EU’s Marie Skłodowska-Curie Actions open doors for new research talent and will support cutting edge research. The EU has also launched the ‘Choose Europe for Science' pilot, which is open to researchers from around the world to develop their careers."
15 May 2025,Montenegro Joins the EU's LIFE Programme for Environment and Climate Action,https://environment.ec.europa.eu/news/montenegro-joins-eus-life-programme-environment-and-climate-action-2025-05-15_en,"A cornerstone of the European Union's commitment to environmental protection and climate action, the LIFE programme offers Montenegro support to improve its environmental and climate policies and practices."
15 May 2025,Commission final report: Emergency measure on the fossil fuels sector in support of European consumers and businesses,https://taxation-customs.ec.europa.eu/news/commission-final-report-emergency-measure-fossil-fuels-sector-support-european-consumers-and-2025-05-15_en,"The Commission presents its final findings on the collected proceeds for 2022 and 2023, and estimated remaining proceeds, against the backdrop of the evolution in the general situation of the fossil fuel sector."
15 May 2025,Commission and EU rail sector launch Women in Rail Award 2025,https://transport.ec.europa.eu/news-events/news/commission-and-eu-rail-sector-launch-women-rail-award-2025-2025-05-15_en,Apply for one of the three award categories before 6 June 2025
15 May 2025,EAfA Member Spotlight: ENGIM Foundation,https://employment-social-affairs.ec.europa.eu/news/eafa-member-spotlight-engim-foundation-2025-05-15_en,"Joining the European Alliance for Apprenticeships (EAfA) and committing to a pledge brings numerous advantages. Boost your organisation’s visibility, connect with others, and enhance the quality of your apprenticeships through valuable collaboration."
15 May 2025,Commission preliminarily finds TikTok's ad repository in breach of the Digital Services Act,https://ec.europa.eu/commission/presscorner/detail/en/ip_25_1223,"Today, the Commission has informed TikTok of its preliminary view that the company does not fulfil the Digital Services Act (DSA)'s obligation to publish an advertisement repository."
15 May 2025,Commission invests €1.25 billion in researchers and invites them to ‘Choose Europe for Science',https://ec.europa.eu/commission/presscorner/detail/en/ip_25_1221,Europe is stepping up its ambition to cement the position of a global leader in research. New calls worth over €1.25 billion in 2025 under the Marie Skłodowska-Curie Actions (MSCA) open doors for new talents.
14 May 2025,Omnibus III,https://agriculture.ec.europa.eu/overview-vision-agriculture-food/eu-actions-address-farmers-concerns_en#ref-2025-cap-simplification-and-competitiveness-package,"To simplify the Common Agricultural Policy (CAP) and boost farmers' competitiveness, this large package of measures targets the administrative burden, controls, implementation, crisis response and investment needs of the sector."
14 May 2025,EU and Egypt successfully conclude negotiations on Horizon Europe,https://north-africa-middle-east-gulf.ec.europa.eu/news/eu-and-egypt-successfully-conclude-negotiations-horizon-europe-2025-05-14_en,"The Commission and the Arab Republic of Egypt have successfully concluded negotiations on Egypt’s association to Horizon Europe, the EU’s flagship research and innovation funding programme. The Agreement is expected to be signed by November 2025, with its entry into force subject to final validation"
14 May 2025,Libya: Statement by the Spokesman,https://north-africa-middle-east-gulf.ec.europa.eu/news/libya-statement-spokesman-2025-05-14_en,The European Union expresses its strong support for the recent announcement of a truce and the subsequent de-escalation of tensions in Tripoli.
14 May 2025,Innovation Fund 2024: Investing into the future of net-zero technologies and electric vehicle battery cell manufacturing,https://climate.ec.europa.eu/news-your-voice/news/innovation-fund-2024-investing-future-net-zero-technologies-and-electric-vehicle-battery-cell-2025-05-14_en,"The 2024 Innovation Fund calls drew 373 project proposals for net-zero tech and EV battery manufacturing, showing strong EU industry commitment to climate goals. Up to €3.4 billion in funding will support Europe's clean, competitive, and resilient future."
14 May 2025,Commission simplifies Common Agricultural Policy to support farmers and enhance competitiveness,https://agriculture.ec.europa.eu/media/news/commission-simplifies-common-agricultural-policy-support-farmers-and-enhance-competitiveness-2025-05-14_en,"The European Commission is presenting a package of measures targeting the administrative burden, controls, implementation, crisis response and investment needs of the EU agricultural sector."
14 May 2025,Announcement of next auction (EU-Bonds) on 19-05-2025,https://commission.europa.eu/news/announcement-next-auction-eu-bonds-19-05-2025-2025-05-14_en,Auction announcement EU-Bonds.
14 May 2025,In focus: EU initiatives for a just energy transition,https://energy.ec.europa.eu/news/focus-eu-initiatives-just-energy-transition-2025-05-14_en,This article explores some of the European Commission’s key initiatives focusing on the social dimension of the energy transition.
14 May 2025,EmpowerUs Project Highlights Women Making Waves,https://blue-economy-observatory.ec.europa.eu/news/empowerus-project-highlights-women-making-waves-2025-05-14_en,"Funded under the European Union’s Horizon Europe program, EmpowerUs is a €6 million, three-year project that will empower coastal communities to transition towards more resilient, inclusive and sustainable coastal development."
14 May 2025,One in three vehicles registered in Belgium this year is electric,https://urban-mobility-observatory.transport.ec.europa.eu/news-events/news/one-three-vehicles-registered-belgium-year-electric-2025-05-14_en,"In the first quarter of 2025, one in three newly registered cars in Belgium was fully electric—a figure that’s expected to rise steadily in the years ahead."
14 May 2025,Le Directeur général pour la région MENA de la Commission européenne en visite au Maroc pour approfondir le partenariat euro-marocain,https://north-africa-middle-east-gulf.ec.europa.eu/news/le-directeur-general-pour-la-region-mena-de-la-commission-europeenne-en-visite-au-maroc-pour-2025-05-14_en,"Le Directeur général du Moyen-Orient, de l’Afrique du Nord et du Golfe (DG MENA) de la Commission européenne, Monsieur Stefano Sannino, effectue une visite officielle au Maroc, du 12 au 14 mai 2025."
14 May 2025,Revitalising neighbourhoods across Europe with the New European Bauhaus Facility,https://new-european-bauhaus.europa.eu/selection-your-contributions/revitalising-neighbourhoods-across-europe-new-european-bauhaus-facility-2025-05-14_en,The first call for proposals under the research and innovation component of the New European Bauhaus (NEB) Facility will soon be launched.
14 May 2025,First Meeting of the EU–Ukraine Task Force on Defence Industrial Cooperation,https://defence-industry-space.ec.europa.eu/first-meeting-eu-ukraine-task-force-defence-industrial-cooperation-2025-05-14_en,"On 12 May 2025 was held the first meeting of the EU–Ukraine Task Force on Defence Industrial Cooperation, in the framework of the second EU–Ukraine Defence Industry Forum. Announced in the White Paper for European Defence Readiness 2030, this Task Force aims to foster Ukraine’s integration into the"
14 May 2025,Simplifying farmers’ lives,https://commission.europa.eu/news/simplifying-farmers-lives-2025-05-14_en,Farmers across the EU face heavy administrative obligations on top of their actual work. Dealing with them is time consuming and costly for farmers and national administrations alike.
14 May 2025,European Commission transfers Daniel Calleja y Crespo as Head of Representation in Madrid,https://ec.europa.eu/commission/presscorner/detail/en/ip_25_1212,No content found
14 May 2025,EU invests €7.3 billion from Horizon Europe to enhance its competitiveness and talent growth,https://ec.europa.eu/commission/presscorner/detail/en/ip_25_1146,The European Commission is investing over €7.3 billion through its newly adopted Horizon Europe work programme for 2025 to strengthen Europe's research and innovation engine and global edge.
13 May 2025,"Commission organises DMA compliance workshops with Alphabet, Amazon, Apple, ByteDance, Meta and Microsoft",https://digital-markets-act.ec.europa.eu/commission-organises-dma-compliance-workshops-alphabet-amazon-apple-bytedance-meta-and-microsoft-2025-05-13_en,"The Commission will again hold technical workshops with interested third parties to receive their views on specific questions that may arise in relation to the measures that Alphabet, Amazon, Apple, ByteDance, Meta and Microsoft have put in place to ensure effective compliance with the DMA."
